{"$schema":"https://json-schema.org/draft/2020-12/schema","title":"Yalken R2.4 StageInstance V2","type":"object","additionalProperties":false,"required":["schemaVersion","stageId","authorityId","ownerAuthorityBindingDigest","sourcePlanDigest","externalSourcePlanDigest","compiledProgramFileDigest","baseSha","headSha","treeSha","branch","targetRemote","fixedBindings","operations","commands","acceptanceSignals","authorityCeiling","externalEffects","predecessors","lease","model","reasoningEffort","stopConditions"],"properties":{"schemaVersion":{"const":"STAGE_INSTANCE_V2"},"stageId":{"type":"string","minLength":1},"authorityId":{"type":"string","minLength":1},"ownerAuthorityBindingDigest":{"$ref":"#/$defs/digest"},"sourcePlanDigest":{"$ref":"#/$defs/digest"},"externalSourcePlanDigest":{"$ref":"#/$defs/digest"},"compiledProgramFileDigest":{"$ref":"#/$defs/digest"},"baseSha":{"$ref":"#/$defs/sha"},"headSha":{"$ref":"#/$defs/sha"},"treeSha":{"$ref":"#/$defs/sha"},"branch":{"type":"string","pattern":"^codex/"},"targetRemote":{"const":"origin"},"fixedBindings":{"type":"array","minItems":1,"uniqueItems":true,"items":{"type":"object","additionalProperties":false,"required":["path","sha256"],"properties":{"path":{"$ref":"#/$defs/path"},"sha256":{"$ref":"#/$defs/digest"}}}},"operations":{"type":"object","additionalProperties":false,"required":["readPaths","modifyPaths","createPaths","deletePaths","renamePairs"],"properties":{"readPaths":{"$ref":"#/$defs/paths"},"modifyPaths":{"$ref":"#/$defs/paths"},"createPaths":{"$ref":"#/$defs/paths"},"deletePaths":{"$ref":"#/$defs/paths"},"renamePairs":{"type":"array","items":{"type":"object","additionalProperties":false,"required":["from","to"],"properties":{"from":{"$ref":"#/$defs/path"},"to":{"$ref":"#/$defs/path"}}}}}},"commands":{"type":"array","minItems":1,"uniqueItems":true,"items":{"type":"string","minLength":1}},"acceptanceSignals":{"type":"array","minItems":1,"uniqueItems":true,"items":{"type":"string","minLength":1}},"authorityCeiling":{"type":"array","minItems":1,"uniqueItems":true,"items":{"type":"string"}},"externalEffects":{"type":"array","uniqueItems":true,"items":{"type":"string"}},"predecessors":{"type":"array","items":{"type":"object"}},"lease":{"type":"object","additionalProperties":false,"required":["fencingCounter","status","wip","predecessorReleaseDigest"],"properties":{"fencingCounter":{"type":"integer","minimum":1},"status":{"const":"ACTIVE"},"wip":{"const":1},"predecessorReleaseDigest":{"$ref":"#/$defs/digest"}}},"model":{"const":"gpt-5.6-sol"},"reasoningEffort":{"const":"xhigh"},"stopConditions":{"type":"array","minItems":1,"uniqueItems":true,"items":{"type":"string"}}},"$defs":{"digest":{"type":"string","pattern":"^[0-9a-f]{64}$"},"sha":{"type":"string","pattern":"^[0-9a-f]{40}$"},"path":{"type":"string","minLength":1,"pattern":"^(?!/)(?!.*\\\\)(?!.*(?:^|/)\\.\\.?(?:/|$)).+$"},"paths":{"type":"array","uniqueItems":true,"items":{"$ref":"#/$defs/path"}}}}
