{"schemaVersion":"STAGE_INSTANCE_V2","stageId":"WP-504_DOSSIER_LAYOUT_LINKS","authorityId":"OWNER_AUTHORIZED_YALKEN_R24_WP504_PINNED_TOOLCHAIN_SUCCESSOR_V2","ownerAuthorityBindingDigest":"be68bd97021d13fbfb75c73791bda7f6bfeebecebf525d4a927d1a4c9fe9efd6","sourcePlanDigest":"1f5b5b7b63a9f7806db1ecbcd8fa5f16484a73df3fe51f9a5d699d52f4c3fb9a","externalSourcePlanDigest":"1f5b5b7b63a9f7806db1ecbcd8fa5f16484a73df3fe51f9a5d699d52f4c3fb9a","compiledProgramFileDigest":"da754a8a0e2c09014f342b908502e83ab975488ab665feb2a8a66d0b0d46ae0a","baseSha":"38a495f5beca286f134e20a991cb69dc19e6379f","headSha":"38a495f5beca286f134e20a991cb69dc19e6379f","treeSha":"ed61f208dda5a9340b4697cdaf3487d6e66f7b90","branch":"codex/r24-wp504-dossier-layout-links-v1-20260901","targetRemote":"origin","fixedBindings":[{"path":"docs/OPS/R24/CORRECTIVE/AUDIT_R2_CARRIER_REGISTRY_V19.json","sha256":"afa7a51abf8a0e52ae6c6c6277a70b37337969fa50878bd089ffdd2a587197db"},{"path":"docs/OPS/R24/CORRECTIVE/PROGRAM_TEMPLATE_V1_1.json","sha256":"6c833c964318da3e61e1743365f8763206be838647b5222c187b3bda8d1c6b9a"},{"path":"docs/OPS/R24/CORRECTIVE/STAGE_REGISTRY_V1.json","sha256":"c8af046b5918f43a50af66886b0b5c9d2e22ea6501240d4b239101d8836ced1a"},{"path":"docs/OPS/R24/CORRECTIVE/STANDING_AUTHORITY_BINDING_V1.json","sha256":"be68bd97021d13fbfb75c73791bda7f6bfeebecebf525d4a927d1a4c9fe9efd6"},{"path":"docs/OPS/R24/CORRECTIVE/TERMINAL_ATTESTATION_TRUST_MODEL_V1.json","sha256":"4f6e4b3a191e0302ea44646659e8c2f71121af7d808cc0ee768269b4e156840d"},{"path":"scripts/ops/r24/corrective/stage-admission-verifier-v2.mjs","sha256":"b9cb1d3ad98bbdd0e56dedc4563796f40d9768f1345b57324625ef8386c5bd3f"},{"path":"scripts/ops/r24/corrective/stage-admission-verifier.mjs","sha256":"82e49d577b79b41b26b67e25b7ce0fd81f26fb973232194fef8d96d6c563c6f9"}],"operations":{"readPaths":["AGENTS.md","CANON.md","docs/OPS/R24/CORRECTIVE/AUDIT_R2_CARRIER_REGISTRY_V19.json","docs/OPS/R24/CORRECTIVE/PROGRAM_TEMPLATE_V1_1.json","docs/OPS/R24/CORRECTIVE/STAGE_REGISTRY_V1.json","docs/OPS/R24/CORRECTIVE/STANDING_AUTHORITY_BINDING_V1.json","docs/OPS/R24/CORRECTIVE/TERMINAL_ATTESTATION_TRUST_MODEL_V1.json","docs/OPS/R24/CORRECTIVE/WP503_MAIN_PRODUCT_STAGE_ADMISSION_ATTESTATION_V10.json","docs/OPS/R24/CORRECTIVE/WP503_MAIN_PRODUCT_STAGE_INSTANCE_V10.json","docs/OPS/R24/CORRECTIVE/WP503_TERMINAL_SUPPLEMENT_V6.json","docs/OPS/R24/EXECUTABLE_PROGRAM_R2_4.json","scripts/ops/r24/corrective/stage-admission-verifier-v2.mjs","scripts/ops/r24/corrective/stage-admission-verifier.mjs","src/core/atlas-surface-v1.mjs","src/derived/atlas/deriveAtlasEntityDossier.mjs","src/derived/atlas/deriveAtlasRelationDossier.mjs"],"modifyPaths":[".github/workflows/oss-policy.yml","docs/OPS/R24/CORRECTIVE/C1B_TEST_INVENTORY_V1.json","package.json","src/renderer/design-os/atlasFeatureIntegrationManifest.mjs","src/renderer/design-os/atlasSlotCatalog.v1.mjs","src/renderer/editor.bundle.js","src/renderer/editor.js","src/renderer/index.html","src/renderer/styles.css"],"createPaths":["docs/OPS/R24/CORRECTIVE/AUDIT_R2_CARRIER_REGISTRY_V20.json","docs/OPS/R24/CORRECTIVE/WP503_EXTERNAL_TERMINAL_CLOSURE_V1.json","docs/OPS/R24/CORRECTIVE/WP504_ACCEPTANCE_MATRIX_V1.json","docs/OPS/R24/CORRECTIVE/WP504_EFFECTIVE_STATE_V1.json","docs/OPS/R24/CORRECTIVE/WP504_GOVERNANCE_CHANGE_APPROVALS_V1.json","docs/OPS/R24/CORRECTIVE/WP504_LEASE_RELEASE_V1.json","docs/OPS/R24/CORRECTIVE/WP504_LOCAL_TOOLCHAIN_FAILURE_V1.json","docs/OPS/R24/CORRECTIVE/WP504_MAIN_PRODUCT_OWNER_AUTHORITY_AMENDMENT_V1.json","docs/OPS/R24/CORRECTIVE/WP504_MAIN_PRODUCT_OWNER_AUTHORITY_AMENDMENT_V2.json","docs/OPS/R24/CORRECTIVE/WP504_MAIN_PRODUCT_SELECTION_RECEIPT_V1.json","docs/OPS/R24/CORRECTIVE/WP504_MAIN_PRODUCT_STAGE_ADMISSION_ATTESTATION_V1.json","docs/OPS/R24/CORRECTIVE/WP504_MAIN_PRODUCT_STAGE_ADMISSION_ATTESTATION_V2.json","docs/OPS/R24/CORRECTIVE/WP504_MAIN_PRODUCT_STAGE_INSTANCE_V1.json","docs/OPS/R24/CORRECTIVE/WP504_MAIN_PRODUCT_STAGE_INSTANCE_V2.json","docs/OPS/R24/CORRECTIVE/WP504_PROTECTED_WIP_BEFORE_V1.json","docs/OPS/R24/CORRECTIVE/WP504_STAGE_REGISTRY_V1.json","docs/OPS/R24/CORRECTIVE/WP504_TERMINAL_RECEIPT_V1.json","docs/OPS/R24/CORRECTIVE/WP504_TERMINAL_SUPPLEMENT_V1.json","scripts/ops/r24/wp504-terminal-verifier.mjs","src/core/atlas-dossier-layout-links-v1.mjs","src/renderer/atlasDossierLayoutPresentationModel.mjs","test/contracts/r24-wp504-terminal-carriers.contract.test.mjs","test/unit/r24-wp504-dossier-layout-links-integration.test.js","test/unit/r24-wp504-dossier-layout-links-mutants.test.js","test/unit/r24-wp504-dossier-layout-links.test.js"],"deletePaths":[],"renamePairs":[]},"commands":["EFFECTIVE_MODE=STRICT GOVERNANCE_CHANGE_APPROVALS_PATH=docs/OPS/R24/CORRECTIVE/WP504_GOVERNANCE_CHANGE_APPROVALS_V1.json node scripts/ops/governance-change-detection.mjs --json --base-ref origin/main --approvals-path docs/OPS/R24/CORRECTIVE/WP504_GOVERNANCE_CHANGE_APPROVALS_V1.json","GOVERNANCE_CHANGE_APPROVALS_PATH=docs/OPS/R24/CORRECTIVE/WP504_GOVERNANCE_CHANGE_APPROVALS_V1.json npm test","gh pr checks PR --watch","gh pr create","gh pr merge PR --merge","gh run view RUN --json status,conclusion,headSha,event,attempt,jobs","git add -- EXACT_WP504_WRITE_SET","git commit -m Deliver WP504 dossier layout links","git diff --cached --check","git diff --check","git diff --name-status origin/main","git fetch origin main","git push origin codex/r24-wp504-dossier-layout-links-v1-20260901","git rev-parse HEAD","git rev-parse HEAD^{tree}","git rev-parse origin/main","git status --short --branch","node --test test/unit/r24-wp504-dossier-layout-links.test.js test/unit/r24-wp504-dossier-layout-links-integration.test.js test/unit/r24-wp504-dossier-layout-links-mutants.test.js test/contracts/r24-wp504-terminal-carriers.contract.test.mjs","node scripts/ops/r24/corrective/protected-wip-snapshot.mjs writer=WRITER predecessor=PREDECESSOR_WRITER","node scripts/ops/r24/corrective/stage-admission-verifier-v2.mjs --repo-root BASE --authority WP504_MAIN_PRODUCT_OWNER_AUTHORITY_AMENDMENT_V1.json --stage-instance WP504_MAIN_PRODUCT_STAGE_INSTANCE_V1.json --stage-admission WP504_MAIN_PRODUCT_STAGE_ADMISSION_ATTESTATION_V1.json --expected-verifier-digest b9cb1d3ad98bbdd0e56dedc4563796f40d9768f1345b57324625ef8386c5bd3f --expected-authority-digest AUTHORITY_DIGEST","node scripts/ops/r24/test-inventory.mjs --check docs/OPS/R24/CORRECTIVE/C1B_TEST_INVENTORY_V1.json","node scripts/ops/r24/wp504-terminal-verifier.mjs --check","npm audit --omit=dev --audit-level=high","npm ci --engine-strict","npm run agent:guardrails","npm run build:renderer","npm run design-os:doctrine","npm run oss:policy","npm run test:atlas-graph","npm run test:electron","npm run test:r24-e0","npm run test:r24-wp503","npm run test:r24-wp504","npm run test:rtk","npm test","brew install node@22","PATH=/opt/homebrew/opt/node@22/bin:$PATH npm ci --engine-strict","PATH=/opt/homebrew/opt/node@22/bin:$PATH npm run build:renderer"],"acceptanceSignals":["ALL_EVIDENCE_EXACT_AND_REVISION_BOUND","ATLAS_DOSSIER_LAYOUT_LINKS_MODEL_PASS","ATLAS_DOSSIER_RENDERER_ACCESSIBILITY_PASS","DIFFERENTIAL_ORACLE_PASS","EXACT_TYPED_DEEP_LINKS_READ_ONLY","GOVERNANCE_STRICT_PASS","GRAPH_LIST_TABLE_DOSSIER_PARITY","LARGE_CORPUS_BUDGET_PASS","LEASE_68_RELEASED_WIP_0","LOD_SURVIVOR_POSITIONS_STABLE","NORMAL_PROTECTED_MERGE","POSTMERGE_EXACT_HEAD","PROGRAM_DONE_FALSE","PROTECTED_WIP_UNCHANGED","SOURCE_PLAN_ROLES_DISTINCT","STALE_AND_HOSTILE_MUTANTS_REJECTED","TEST_INVENTORY_ZERO_UNEXPLAINED_SKIP","WP503_EXTERNAL_TERMINAL_CLOSURE_BOUND"],"authorityCeiling":["BOUNDED_CI_OPERATION","BOUNDED_REPOSITORY_WRITE","BRANCH_WORKTREE","COMMIT","GITHUB_PR","GITHUB_PROTECTED_MERGE","LOCAL_TEST_BUILD_EVIDENCE","NON_DESTRUCTIVE_LOCAL_TOOLCHAIN","PR_CREATE_OR_UPDATE","PUSH","READ_ONLY_GITHUB_API"],"externalEffects":["GITHUB_CI","GITHUB_PR","GITHUB_PROTECTED_MERGE","GIT_PUSH"],"predecessors":[{"id":"HISTORICAL_STAGE_ADMISSION_VERIFIER_CONTRACT","digest":"925b4c23f1cad674720ee6a22fcd74cc2169b16bbc161be5d43535f20dd2ee31","status":"FIXED_BINDING_PRESERVED"},{"id":"WP503_EXTERNAL_TERMINAL_RECEIPT","digest":"c1a3868eb2b69bedef549e6dd05fbc4c35686f140b65267e29b008be7bc9d357","status":"EXTERNALLY_VERIFIED_DONE"},{"id":"WP503_EXTERNAL_TERMINAL_VERIFICATION","digest":"c2c8c30f4598c16e272e1e77b947513c9d47751165b4b886e236a82c7c963b8e6","status":"INDEPENDENT_VERIFICATION_PASS"},{"id":"WP503_EXTERNAL_TERMINAL_ZIP","digest":"17c4daa7a91c292f939596fcd689e4999fcacf9e6b617839de62fe654a5a6b20","status":"ARCHIVE_BYTES_VERIFIED"},{"id":"WP503_LEASE_67_RELEASE","digest":"65fb353a94ec1e592a3e5161673eabce7f850df9f2a4c2c9151e40963b36f39c","status":"RELEASED_WIP_0"},{"id":"WP503_TERMINAL_SUPPLEMENT_V6","digest":"4342d96ff4c40ce9bcc0c1cd0b0060655649d46115fc0f55e06708cc23e02bdc","status":"SUPERSEDED_BY_EXTERNAL_TERMINAL_CLOSURE"},{"id":"WP504_V1_AUTHORITY","digest":"77adeaf7ce20249c3780263f5fc429983bc45181643e98fc9ce18747532f6105","status":"SUPERSEDED_BY_APPEND_ONLY_PINNED_TOOLCHAIN_SUCCESSOR"},{"id":"WP504_V1_STAGE_INSTANCE","digest":"b3ed08004f3a63cdd72dc8ebb95f23ee82b31b0379683569006cd7fcfbbe243a","status":"SUPERSEDED_BY_APPEND_ONLY_PINNED_TOOLCHAIN_SUCCESSOR"},{"id":"WP504_V1_STAGE_ADMISSION","digest":"76df94df2070083668105953253749ca97fc21fc9aa23556f687d2236cfe22c8","status":"SUPERSEDED_BY_APPEND_ONLY_PINNED_TOOLCHAIN_SUCCESSOR"},{"id":"WP504_LOCAL_TOOLCHAIN_FAILURE","digest":"06ed97e4d8102c858954b975034e96372f98bd5dfab44841eed6f25eb6a7aa42","status":"BOUND_EXACT_FAILURE"}],"lease":{"fencingCounter":68,"status":"ACTIVE","wip":1,"predecessorReleaseDigest":"65fb353a94ec1e592a3e5161673eabce7f850df9f2a4c2c9151e40963b36f39c"},"model":"gpt-5.6-sol","reasoningEffort":"xhigh","stopConditions":["BASE_BRANCH_SCOPE_OR_WORKTREE_AUTHORITY_DRIFT","DIRTY_ACTIVE_WORKTREE_BEFORE_MUTATION","EVIDENCE_IDENTITY_OR_DENOMINATOR_DRIFT","PINNED_TOOLCHAIN_UNAVAILABLE","PROTECTED_WIP_MUTATION","REQUIRED_TEST_CI_OR_PROTECTED_MERGE_FAILURE","SECOND_ACTIVE_WRITER_OR_WIP_GREATER_THAN_ONE","UNADMITTED_PATH_OR_COMMAND"]}
