{
  "schemaVersion": "STAGE_INSTANCE_V2",
  "stageId": "WP-501_TIME_KNOWLEDGE_PERFORMANCE_INTEGRATION",
  "authorityId": "OWNER_AUTHORIZED_YALKEN_R24_WP501_PERFORMANCE_INTEGRATION_SINGLE_TERMINAL_PR_V1",
  "ownerAuthorityBindingDigest": "be68bd97021d13fbfb75c73791bda7f6bfeebecebf525d4a927d1a4c9fe9efd6",
  "sourcePlanDigest": "1f5b5b7b63a9f7806db1ecbcd8fa5f16484a73df3fe51f9a5d699d52f4c3fb9a",
  "externalSourcePlanDigest": "1f5b5b7b63a9f7806db1ecbcd8fa5f16484a73df3fe51f9a5d699d52f4c3fb9a",
  "compiledProgramFileDigest": "da754a8a0e2c09014f342b908502e83ab975488ab665feb2a8a66d0b0d46ae0a",
  "baseSha": "d8928ba0a6f19225f289bbd6deb30ea2d2f9689e",
  "branch": "codex/r24-wp501-time-knowledge-v1-20260901",
  "fixedBindings": [
    {"path":"docs/OPS/R24/CORRECTIVE/PROGRAM_TEMPLATE_V1_1.json","sha256":"6c833c964318da3e61e1743365f8763206be838647b5222c187b3bda8d1c6b9a"},
    {"path":"docs/OPS/R24/CORRECTIVE/STAGE_REGISTRY_V1.json","sha256":"c8af046b5918f43a50af66886b0b5c9d2e22ea6501240d4b239101d8836ced1a"},
    {"path":"docs/OPS/R24/CORRECTIVE/STANDING_AUTHORITY_BINDING_V1.json","sha256":"be68bd97021d13fbfb75c73791bda7f6bfeebecebf525d4a927d1a4c9fe9efd6"},
    {"path":"docs/OPS/R24/CORRECTIVE/TERMINAL_ATTESTATION_TRUST_MODEL_V1.json","sha256":"4f6e4b3a191e0302ea44646659e8c2f71121af7d808cc0ee768269b4e156840d"},
    {"path":"docs/OPS/R24/CORRECTIVE/WP501_GATE_INTEGRATION_STAGE_ADMISSION_ATTESTATION_V1.json","sha256":"df8844ce348f9e93e51f7245e9a52c86922da562c928f84179ad7f84208e9972"},
    {"path":"docs/OPS/R24/CORRECTIVE/WP501_MAIN_PRODUCT_STAGE_ADMISSION_ATTESTATION_V1.json","sha256":"61b437c37deb503d7904272a734511f987ec9a4ca3a448c2c430639db122ac2e"},
    {"path":"docs/OPS/R24/CORRECTIVE/WP501_TERMINAL_RECEIPT_V1.json","sha256":"a625f7bafeeb4f412b3e8d77a551f4724035db07ebe5659ed151c1fd0559304e"},
    {"path":"scripts/ops/r24/corrective/stage-admission-verifier-v2.mjs","sha256":"b9cb1d3ad98bbdd0e56dedc4563796f40d9768f1345b57324625ef8386c5bd3f"}
  ],
  "acceptanceSignals": [
    "DETERMINISTIC_INDEX_OUTPUT_PRESERVED",
    "HOSTILE_UNADMITTED_PATH_REJECTED",
    "INDEX_CONSTRUCTION_LINEAR_IN_CELL_DENOMINATOR",
    "LARGE_CORPUS_10000_COMPILE_UNDER_5000MS",
    "LEASE_64_REMAINS_ACTIVE_WIP_1_UNTIL_EXTERNAL_GATES",
    "PROGRAM_DONE_FALSE",
    "SAME_SINGLE_TERMINAL_PR",
    "WP501_GATE_EXCEPTION_STOPS_AT_PERFORMANCE_BASE",
    "WP501_PERFORMANCE_EXCEPTION_COVERS_EXACT_AMENDMENT_WRITE_SET"
  ],
  "authorityCeiling": [
    "BOUNDED_CI_OPERATION",
    "BOUNDED_REPOSITORY_WRITE",
    "BRANCH_WORKTREE",
    "COMMIT",
    "GITHUB_PR",
    "GITHUB_PROTECTED_MERGE",
    "LOCAL_TEST_BUILD_EVIDENCE",
    "PROTECTED_NORMAL_MERGE",
    "PR_CREATE_OR_UPDATE",
    "PUSH",
    "READ_ONLY_GITHUB_API"
  ],
  "externalEffects": ["GITHUB_CI","GITHUB_PR","GITHUB_PROTECTED_MERGE","GIT_PUSH"],
  "predecessors": [
    {"id":"WP500_LEASE_RELEASE","digest":"8085f4786f9ef3068cfa8a1566a1aef0b6486e24dc1ecedc9535010de4cd4c8f","status":"RELEASED_WIP_0"},
    {"id":"WP501_GATE_INTEGRATION_STAGE_ADMISSION","digest":"df8844ce348f9e93e51f7245e9a52c86922da562c928f84179ad7f84208e9972","status":"ADMITTED"},
    {"id":"WP501_TERMINAL_RECEIPT","digest":"a625f7bafeeb4f412b3e8d77a551f4724035db07ebe5659ed151c1fd0559304e","status":"PRECOMPUTED_CONDITIONAL_TERMINAL_RECEIPT_PENDING_EXTERNAL_GATES"}
  ],
  "lease": {
    "fencingCounter": 64,
    "status": "ACTIVE",
    "wip": 1,
    "predecessorReleaseDigest": "8085f4786f9ef3068cfa8a1566a1aef0b6486e24dc1ecedc9535010de4cd4c8f"
  },
  "headSha": "d8928ba0a6f19225f289bbd6deb30ea2d2f9689e",
  "treeSha": "343e2b90611a6d6f1f648a70eb2b00efbd6895c7",
  "targetRemote": "origin",
  "operations": {
    "readPaths": [
      "AGENTS.md",
      "CANON.md",
      "docs/OPS/R24/CORRECTIVE/PROGRAM_TEMPLATE_V1_1.json",
      "docs/OPS/R24/CORRECTIVE/STAGE_REGISTRY_V1.json",
      "docs/OPS/R24/CORRECTIVE/STANDING_AUTHORITY_BINDING_V1.json",
      "docs/OPS/R24/CORRECTIVE/TERMINAL_ATTESTATION_TRUST_MODEL_V1.json",
      "docs/OPS/R24/CORRECTIVE/WP500_LEASE_RELEASE_V1.json",
      "docs/OPS/R24/CORRECTIVE/WP501_GATE_INTEGRATION_OWNER_AUTHORITY_V1.json",
      "docs/OPS/R24/CORRECTIVE/WP501_GATE_INTEGRATION_STAGE_ADMISSION_ATTESTATION_V1.json",
      "docs/OPS/R24/CORRECTIVE/WP501_GATE_INTEGRATION_STAGE_INSTANCE_V1.json",
      "docs/OPS/R24/CORRECTIVE/WP501_MAIN_PRODUCT_STAGE_ADMISSION_ATTESTATION_V1.json",
      "docs/OPS/R24/CORRECTIVE/WP501_TERMINAL_RECEIPT_V1.json",
      "scripts/ops/r24/corrective/stage-admission-verifier-v2.mjs",
      "test/unit/r24-wp501-time-knowledge-integration.test.js"
    ],
    "modifyPaths": [
      "docs/OPS/R24/CORRECTIVE/C1B_TEST_INVENTORY_V1.json",
      "docs/OPS/R24/CORRECTIVE/WP501_GOVERNANCE_CHANGE_APPROVALS_V1.json",
      "scripts/ops/r24/corrective/post-audit-certification-set.mjs",
      "src/core/atlas-time-knowledge-v1.mjs",
      "test/contracts/r24-post-audit-certification-set.contract.test.mjs"
    ],
    "createPaths": [
      "docs/OPS/R24/CORRECTIVE/WP501_PERFORMANCE_INTEGRATION_OWNER_AUTHORITY_V1.json",
      "docs/OPS/R24/CORRECTIVE/WP501_PERFORMANCE_INTEGRATION_STAGE_ADMISSION_ATTESTATION_V1.json",
      "docs/OPS/R24/CORRECTIVE/WP501_PERFORMANCE_INTEGRATION_STAGE_INSTANCE_V1.json"
    ],
    "deletePaths": [],
    "renamePairs": []
  },
  "commands": [
    "EFFECTIVE_MODE=STRICT GOVERNANCE_CHANGE_APPROVALS_PATH=docs/OPS/R24/CORRECTIVE/WP501_GOVERNANCE_CHANGE_APPROVALS_V1.json node scripts/ops/governance-change-detection.mjs --json --base-ref origin/main --approvals-path docs/OPS/R24/CORRECTIVE/WP501_GOVERNANCE_CHANGE_APPROVALS_V1.json",
    "GOVERNANCE_CHANGE_APPROVALS_PATH=docs/OPS/R24/CORRECTIVE/WP501_GOVERNANCE_CHANGE_APPROVALS_V1.json npm test",
    "git add -- EXACT_WP501_PERFORMANCE_INTEGRATION_WRITE_SET",
    "git commit -m Optimize WP-501 deterministic indexes",
    "git diff --cached --check",
    "git diff --check",
    "git diff --name-status origin/main",
    "git fetch origin main",
    "git push origin codex/r24-wp501-time-knowledge-v1-20260901",
    "git rev-parse HEAD",
    "git rev-parse HEAD^{tree}",
    "git status --short --branch",
    "node --test test/contracts/r24-post-audit-certification-set.contract.test.mjs",
    "node --test test/unit/r24-wp501-time-knowledge-integration.test.js",
    "node scripts/ops/r24/corrective/stage-admission-verifier-v2.mjs --repo-root BASE --authority WP501_PERFORMANCE_INTEGRATION_OWNER_AUTHORITY_V1.json --stage-instance WP501_PERFORMANCE_INTEGRATION_STAGE_INSTANCE_V1.json --stage-admission WP501_PERFORMANCE_INTEGRATION_STAGE_ADMISSION_ATTESTATION_V1.json --expected-verifier-digest b9cb1d3ad98bbdd0e56dedc4563796f40d9768f1345b57324625ef8386c5bd3f --expected-authority-digest AUTHORITY_DIGEST",
    "node scripts/ops/r24/test-inventory.mjs --check docs/OPS/R24/CORRECTIVE/C1B_TEST_INVENTORY_V1.json",
    "node scripts/ops/r24/test-inventory.mjs --write docs/OPS/R24/CORRECTIVE/C1B_TEST_INVENTORY_V1.json",
    "npm run agent:guardrails",
    "npm run test:r24-post-audit",
    "npm test"
  ],
  "model": "gpt-5.6-sol",
  "reasoningEffort": "xhigh",
  "stopConditions": [
    "AUTHORITY_UNAVAILABLE_OR_COMPROMISED",
    "BASE_HEAD_TREE_OR_DELTA_AMBIGUOUS",
    "DIRTY_OR_PRESERVED_WIP_WOULD_BE_LOST",
    "EXACT_WRITE_SET_OR_COMMAND_SCOPE_WOULD_EXPAND",
    "LEASE_FENCE_OR_ONE_WRITER_VIOLATION",
    "MODEL_OR_REASONING_RUNTIME_MISMATCH",
    "ORIGIN_MAIN_DRIFT",
    "PROGRAM_DONE_ATTEMPT",
    "SECOND_GRAPH_NODE_ATTEMPT",
    "SECOND_WRITER_ATTEMPT"
  ]
}
